DepartmentName,Field,Area,Umbrella,is_STEM
"Mathematics, School of",Mathematics,Mathematical Sciences,Mathematics and Computing,True
"Mathematics, Department of",Mathematics,Mathematical Sciences,Mathematics and Computing,True
"Psychology, School of",Psychology,Psychological Sciences,Social Sciences,False
"Biology, Department of",Biological Sciences,Biological Sciences,Natural Sciences,True
"Psychological Sciences, Department of",Psychology,Psychological Sciences,Social Sciences,False
"Mathematical Sciences, School of",Mathematics,Mathematical Sciences,Mathematics and Computing,True
"Mathematics, Department of",Statistics,Mathematical Sciences,Mathematics and Computing,True
"Physics, School of",Physics,Physical Sciences,Natural Sciences,True
"Risk Management and Insurance, Department of",,Business,Business,False
"Civil and Environmental Engineering, School of",Civil Engineering,Engineering,Engineering,True
"Civil and Environmental Engineering, School of",Environmental Engineering,Engineering,Engineering,True
"Educational Psychology, Department of",Educational Psychology,Psychological Sciences,Social Sciences,False
"Kinesiology and Community Health, Department of","Exercise Science, Kinesiology, Rehab, Health",Health,Health,False
"Linguistics, Department of",Linguistics,Linguistics,Humanities,False
"Psychology, Department of",Psychology,Psychological Sciences,Social Sciences,False
"Communication Studies, Department of",Communication,"Journalism, Media, Communication","Journalism, Media, Communication",False
"Chemistry and Biochemistry, School of",Chemistry,Chemical Sciences,Natural Sciences,True
"Chemistry and Biochemistry, School of",Biochemistry,Biological Sciences,Natural Sciences,True
"Physics, Department of",Physics,Physical Sciences,Natural Sciences,True
"Chemical and Biomolecular Engineering (Polytechnic Institute), Department of",Agricultural Engineering,Engineering,Engineering,True
"Chemical and Biomolecular Engineering (Polytechnic Institute), Department of",Chemical Engineering,Chemical Sciences,Natural Sciences,True
"Aerospace Engineering, School of",Aerospace Engineering,Engineering,Engineering,True
"Aerospace Engineering and Engineering Mechanics, Department of",,Engineering,Engineering,True
"Aerospace Engineering and Engineering Mechanics, Department of",Aerospace Engineering,Engineering,Engineering,True
"Aerospace Engineering, Department of",Aerospace Engineering,Engineering,Engineering,True
"Industrial and Systems Engineering, School of",Industrial Engineering,Engineering,Engineering,True
"Industrial and Systems Engineering, School of",Systems Engineering,Engineering,Engineering,True
"Aerospace Engineering Sciences, Department of",Aerospace Engineering,Engineering,Engineering,True
"Aerospace, Department of",Aerospace Engineering,Engineering,Engineering,True
"Mechanical Science and Engineering, Department of",Mechanical Engineering,Engineering,Engineering,True
"Electrical and Computer Engineering, Department of",Computer Engineering,Computational Sciences,Mathematics and Computing,True
"Electrical and Computer Engineering, Department of",Electrical Engineering,Engineering,Engineering,True
"Mechanical Engineering, School of",Mechanical Engineering,Engineering,Engineering,True
"Aerospace and Ocean Engineering, Department of",Aerospace Engineering,Engineering,Engineering,True
"Mechanical Engineering, Department of",Mechanical Engineering,Engineering,Engineering,True
"Biomedical Engineering, Department of",Biomedical Engineering,Biological Sciences,Natural Sciences,True
"Statistics, Department of",Statistics,Mathematical Sciences,Mathematics and Computing,True
"Public Policy, School of",Public Policy,Public Administration and Policy,Public Administration and Policy,False
"Industrial Engineering and Operations Research, Department of",Industrial Engineering,Engineering,Engineering,True
"Industrial Engineering and Operations Research, Department of",Operations Research,Engineering,Engineering,True
"Population Health Sciences, Department of","Exercise Science, Kinesiology, Rehab, Health",Health,Health,False
"Operations Research and Information Engineering, School of",Operations Research,Engineering,Engineering,True
"Mechanical and Industrial Engineering, Department of",Mechanical Engineering,Engineering,Engineering,True
"Mechanical and Industrial Engineering, Department of",Industrial Engineering,Engineering,Engineering,True
"Industrial and Systems Engineering, Fitts Department of",Industrial Engineering,Engineering,Engineering,True
"Industrial and Systems Engineering, Fitts Department of",Systems Engineering,Engineering,Engineering,True
"Industrial and Enterprise Systems Engineering, Department of",Industrial Engineering,Engineering,Engineering,True
"Industrial and Enterprise Systems Engineering, Department of",Systems Engineering,Engineering,Engineering,True
"Industrial and Manufacturing Engineering, Department of",Industrial Engineering,Engineering,Engineering,True
"Industrial Engineering, Department of",Industrial Engineering,Engineering,Engineering,True
"Industrial and Systems Engineering, Department of",Systems Engineering,Engineering,Engineering,True
"Industrial and Systems Engineering, Department of",Industrial Engineering,Engineering,Engineering,True
"Industrial and Operations Engineering, Department of",Operations Research,Engineering,Engineering,True
"Industrial and Operations Engineering, Department of",Industrial Engineering,Engineering,Engineering,True
"Computer Science, Department of",Computer Science,Computational Sciences,Mathematics and Computing,True
"Systems and Enterprises, School of",Management,Business,Business,False
"Systems and Enterprises, School of",Systems Engineering,Engineering,Engineering,True
"Applied Mathematics and Statistics, Department of",Operations Research,Engineering,Engineering,True
"Applied Mathematics and Statistics, Department of",Statistics,Mathematical Sciences,Mathematics and Computing,True
"Applied Mathematics and Statistics, Department of",,Mathematical Sciences,Mathematics and Computing,True
"Mathematical Sciences, Department of",Mathematics,Mathematical Sciences,Mathematics and Computing,True
"Electrical and Computer Engineering, School of",Electrical Engineering,Engineering,Engineering,True
"Electrical and Computer Engineering, School of",Computer Engineering,Computational Sciences,Mathematics and Computing,True
"Applied Physiology, School of",Physiology,Medical Sciences,Medicine,True
"Applied Physiology, School of",Biological Sciences,Biological Sciences,Natural Sciences,True
"Materials Science and Engineering, School of",Materials Engineering,Engineering,Engineering,True
"Mechanical Engineering and Materials Science, Department of",Mechanical Engineering,Engineering,Engineering,True
"Operations Management, Department of",Management,Business,Business,False
"Operations Management, Department of",Operations Research,Engineering,Engineering,True
"Industrial Design, School of",,"Architecture, Design, Planning",Humanities,False
"Mechanical Engineering and Mechanics, Department of",,Engineering,Engineering,True
"Mechanical Engineering and Mechanics, Department of",Mechanical Engineering,Engineering,Engineering,True
"Mechanical and Nuclear Engineering, Department of",Mechanical Engineering,Engineering,Engineering,True
"Mechanical and Nuclear Engineering, Department of",,Engineering,Engineering,True
"Information Technology Management, Department of",Information Technology,Computational Sciences,Mathematics and Computing,True
"Mechanical and Civil Engineering, Department of",Mechanical Engineering,Engineering,Engineering,True
"Mechanical and Civil Engineering, Department of",Civil Engineering,Engineering,Engineering,True
"Computing and Mathematical Science, Department of",Computer Science,Computational Sciences,Mathematics and Computing,True
"Computing and Mathematical Science, Department of",,Mathematical Sciences,Mathematics and Computing,True
"Architecture, School of",Architecture,"Architecture, Design, Planning",Humanities,False
"Architectural Engineering, Department of",Architecture,"Architecture, Design, Planning",Humanities,False
"Civil and Environmental Engineering, Department of",Civil Engineering,Engineering,Engineering,True
"Civil and Environmental Engineering, Department of",Environmental Engineering,Engineering,Engineering,True
"Automotive Engineering, Department of",Mechanical Engineering,Engineering,Engineering,True
"Bioengineering, Department of",Biomedical Engineering,Biological Sciences,Natural Sciences,True
"Bioengineering, Department of",Agricultural Engineering,Engineering,Engineering,True
"Computer Science, School of",Computer Science,Computational Sciences,Mathematics and Computing,True
"Computer Science, School of",Information Technology,Computational Sciences,Mathematics and Computing,True
"Computing, Informatics and Decision Systems Engineering, School of - Computer Science Faculty",Computer Science,Computational Sciences,Mathematics and Computing,True
"Computing, Informatics and Decision Systems Engineering, School of - Computer Science Faculty",Systems Engineering,Engineering,Engineering,True
"Computing, Informatics and Decision Systems Engineering, School of - Computer Science Faculty",Information Technology,Computational Sciences,Mathematics and Computing,True
"Computer Science and Engineering, Department of",Computer Science,Computational Sciences,Mathematics and Computing,True
"Computer Science and Engineering, Department of",Computer Engineering,Computational Sciences,Mathematics and Computing,True
"Electrical Engineering, Department of",Electrical Engineering,Engineering,Engineering,True
"Interactive Computing, School of",,Computational Sciences,Mathematics and Computing,True
"Management Science, Department of",Management Information Systems,Business,Business,False
"Management, Department of",Management,Business,Business,False
"Organizational Behavior, Department of",,Business,Business,False
"Marketing, Department of",Marketing,Business,Business,False
"Applied Economics and Management, School of",,Economics,Social Sciences,False
"Applied Economics and Management, School of",Management,Business,Business,False
"Accounting, Department of",Accounting,Business,Business,False
"Finance, Department of",Finance,Business,Business,False
"Finance, Managerial Economics, and Real Estate, Area in",Finance,Business,Business,False
"Finance and Economics, Department of",Finance,Business,Business,False
"Finance and Economics, Department of",Economics,Economics,Social Sciences,False
"Finance and Managerial Economics, Department of",Management,Business,Business,False
"Finance and Managerial Economics, Department of",Economics,Economics,Social Sciences,False
"Finance and Managerial Economics, Department of",Finance,Business,Business,False
"Accountancy, Department of",Accounting,Business,Business,False
"Managerial Sciences, Department of",Management,Business,Business,False
"Operations and Decision Technologies, Department of",Operations Research,Engineering,Engineering,True
Technology and Operations Management Unit,,Business,Business,False
"Business, Goizueta School of",Business Administration,Business,Business,False
"Strategy and Innovation, Department of",,Business,Business,False
"Chemistry, Department of",Chemistry,Chemical Sciences,Natural Sciences,True
"Materials Science and Engineering, Department of",Materials Engineering,Engineering,Engineering,True
"Energy, Environmental and Chemical Engineering, Department of",Chemical Engineering,Chemical Sciences,Natural Sciences,True
"Energy, Environmental and Chemical Engineering, Department of",Environmental Engineering,Engineering,Engineering,True
"Chemical and Biomolecular Engineering, School of",Chemical Engineering,Chemical Sciences,Natural Sciences,True
"Chemical and Biomolecular Engineering, School of",Agricultural Engineering,Engineering,Engineering,True
"Materials Engineering, Department of",Materials Engineering,Engineering,Engineering,True
"Chemical and Biomolecular Engineering, Department of",Agricultural Engineering,Engineering,Engineering,True
"Chemical and Biomolecular Engineering, Department of",Chemical Engineering,Chemical Sciences,Natural Sciences,True
"Bioengineering and Therapeutic Sciences, Department of",Agricultural Engineering,Engineering,Engineering,True
"Bioengineering and Therapeutic Sciences, Department of",Biomedical Engineering,Biological Sciences,Natural Sciences,True
"Pharmacology, Department of",Pharmacology,Medical Sciences,Medicine,True
"Computational Science and Engineering, School of",,Computational Sciences,Mathematics and Computing,True
"Computational Science and Engineering, School of",,Engineering,Engineering,True
"Computer and Information Science, Department of",Computer Science,Computational Sciences,Mathematics and Computing,True
"Computer and Information Science, Department of",Information Science,Computational Sciences,Mathematics and Computing,True
"Electrical Engineering and Computer Science, Department of",Computer Engineering,Computational Sciences,Mathematics and Computing,True
"Electrical Engineering and Computer Science, Department of",Electrical Engineering,Engineering,Engineering,True
"Electrical Engineering and Computer Science, Department of",Computer Science,Computational Sciences,Mathematics and Computing,True
"Computer Science and Engineering, Division of",Computer Engineering,Computational Sciences,Mathematics and Computing,True
"Computer Science and Engineering, Division of",Computer Science,Computational Sciences,Mathematics and Computing,True
"Electrical Engineering and Computer Sciences, Department of",Electrical Engineering,Engineering,Engineering,True
"Electrical Engineering and Computer Sciences, Department of",Computer Science,Computational Sciences,Mathematics and Computing,True
"Computer and Information Science and Engineering, Department of",Computer Science,Computational Sciences,Mathematics and Computing,True
"Computer and Information Science and Engineering, Department of",Computer Engineering,Computational Sciences,Mathematics and Computing,True
"Machine Learning, Department of",Computer Science,Computational Sciences,Mathematics and Computing,True
"Environmental Health, Department of",Environmental Health Sciences,Health,Health,False
"Civil and Environmental Engineering and Construction , Department of",Civil Engineering,Engineering,Engineering,True
"Civil and Environmental Engineering and Construction , Department of",Environmental Engineering,Engineering,Engineering,True
"City and Regional Planning, School of",,"Architecture, Design, Planning",Humanities,False
"Sustainable Engineering and The Built Environment, School of",Civil Engineering,Engineering,Engineering,True
"Earth and Atmospheric Sciences, School of",Atmospheric Sciences and Meteorology,Physical Sciences,Natural Sciences,True
"Earth and Atmospheric Sciences, School of",Geology,Earth Sciences,Natural Sciences,True
"Civil Engineering, Department of",Civil Engineering,Engineering,Engineering,True
"Chemical and Environmental Engineering, Department of",Environmental Engineering,Engineering,Engineering,True
"Chemical and Environmental Engineering, Department of",Chemical Engineering,Chemical Sciences,Natural Sciences,True
"Civil, Architectural and Environmental Engineering, Department of",Civil Engineering,Engineering,Engineering,True
"Civil, Architectural and Environmental Engineering, Department of",Environmental Engineering,Engineering,Engineering,True
"Engineering Leadership and Society, Department of",,Engineering,Engineering,True
"Engineering Leadership and Society, Department of",,,,
"Genome Science and Technology, Graduate School of",Genetics,Medical Sciences,Medicine,True
"Genome Science and Technology, Graduate School of",,Medical Sciences,Medicine,True
"Microbiology, Department of",Microbiology,Biological Sciences,Natural Sciences,True
"Literature, Media, and Communication, School of",English Language and Literature,"Language, Literature, Culture",Humanities,False
"Literature, Media, and Communication, School of",Mass Communications and Media Studies,"Journalism, Media, Communication","Journalism, Media, Communication",False
"Information, School of",Information Science,Computational Sciences,Mathematics and Computing,True
"Music, School of",Music,Arts,Humanities,False
"Cell Biology and Neuroscience, Department of",Veterinary Medical Sciences,Medical Sciences,Medicine,True
"Cell Biology and Neuroscience, Department of",Microbiology,Biological Sciences,Natural Sciences,True
"Cell Biology and Neuroscience, Department of",Immunology,Medical Sciences,Medicine,True
"Cell Biology and Neuroscience, Department of",Cell Biology,Biological Sciences,Natural Sciences,True
"Cell Biology and Neuroscience, Department of",Neuroscience,Biological Sciences,Natural Sciences,True
"Biological Sciences, Division of",Biological Sciences,Biological Sciences,Natural Sciences,True
"Molecular Biosciences, Department of",Biochemistry,Biological Sciences,Natural Sciences,True
"Molecular Biosciences, Department of",Molecular Biology,Biological Sciences,Natural Sciences,True
"Molecular Biosciences, Department of",Cell Biology,Biological Sciences,Natural Sciences,True
"Molecular Biosciences, Department of",,Biological Sciences,Natural Sciences,True
"Molecular Genetics and Microbiology, Section of",Microbiology,Biological Sciences,Natural Sciences,True
"Molecular Genetics and Microbiology, Section of",,Medical Sciences,Medicine,True
"Ecology and Evolutionary Biology, Department of",Ecology,Biological Sciences,Natural Sciences,True
"Ecology and Evolutionary Biology, Department of",Evolutionary Biology,Biological Sciences,Natural Sciences,True
"Chemistry and Biochemistry, Department of",Chemistry,Chemical Sciences,Natural Sciences,True
"Chemistry and Biochemistry, Department of",Biochemistry,Biological Sciences,Natural Sciences,True
"Applied Physics and Materials Science, Department of",Materials Engineering,Engineering,Engineering,True
"Applied Physics and Materials Science, Department of",,Physical Sciences,Natural Sciences,True
"Physics and Astronomy, Department of",Physics,Physical Sciences,Natural Sciences,True
"Physics and Astronomy, Department of",Astronomy,Physical Sciences,Natural Sciences,True
"Geoscience, Department of",Geology,Earth Sciences,Natural Sciences,True
"Geoscience, Department of",,Physical Sciences,Natural Sciences,True
"Earth and Ocean Sciences, Department of",Geology,Earth Sciences,Natural Sciences,True
"Earth and Ocean Sciences, Department of",Marine Sciences,Earth Sciences,Natural Sciences,True
"Earth Sciences, Department of",Geology,Earth Sciences,Natural Sciences,True
"Earth, Environmental, and Planetary Sciences, Department of",Geology,Earth Sciences,Natural Sciences,True
"Design, School of",,,,
"Educational Psychology and Special Education, Department of",Curriculum and Instruction,Education,Education,False
"Educational Psychology and Special Education, Department of",Special Education,Education,Education,False
"Educational Psychology and Special Education, Department of",Educational Psychology,Psychological Sciences,Social Sciences,False
"Middle and Secondary Education, Department of",,Education,Education,False
"Chemical and Biomolecular Engineering, Department of",Biomedical Engineering,Biological Sciences,Natural Sciences,True
"Chemical and Biological Engineering, Department of",Agricultural Engineering,Engineering,Engineering,True
"Chemical and Biological Engineering, Department of",Chemical Engineering,Chemical Sciences,Natural Sciences,True
"Electrical and Systems Engineering, Department of",Electrical Engineering,Engineering,Engineering,True
"Electrical and Systems Engineering, Department of",Systems Engineering,Engineering,Engineering,True
"Chemical and Biomedical Engineering, Department of",Biomedical Engineering,Biological Sciences,Natural Sciences,True
"Chemical and Biomedical Engineering, Department of",Chemical Engineering,Chemical Sciences,Natural Sciences,True
"Molecular Pharmacology, Physiology and Biotechnology, Department of",Physiology,Medical Sciences,Medicine,True
"Molecular Pharmacology, Physiology and Biotechnology, Department of",,Medical Sciences,Medicine,True
"Chemical and Biomedical Engineering, Department of",Materials Engineering,Engineering,Engineering,True
"Chemical Engineering, Department of",Chemical Engineering,Chemical Sciences,Natural Sciences,True
"Management Information Systems, Department of",Management Information Systems,Business,Business,False
"Urban and Environmental Planning, Department of",Public Policy,Public Administration and Policy,Public Administration and Policy,False
"Urban and Environmental Planning, Department of",Urban and Regional Planning,"Architecture, Design, Planning",Humanities,False
"Geography, Department of",Geography,Geography,Social Sciences,False
"Geographical Sciences and Urban Planning, School of",Urban and Regional Planning,"Architecture, Design, Planning",Humanities,False
"Geographical Sciences and Urban Planning, School of",Geography,Geography,Social Sciences,False
"Public Affairs, School of",Public Administration,Public Administration and Policy,Public Administration and Policy,False
"City Planning and Real Estate Development, Department of",Urban and Regional Planning,"Architecture, Design, Planning",Humanities,False
Urban Studies Institute,Urban and Regional Planning,"Architecture, Design, Planning",Humanities,False
"Biomedical Informatics, Department of",,Biological Sciences,Natural Sciences,True
"History, Technology and Society, School of",History,History,Humanities,False
"Afroamerican and African Studies, Department of",,"Language, Literature, Culture",Humanities,False
"History, Department of",History,History,Humanities,False
"Community Sustainability, Department of",Environmental Sciences,Earth Sciences,Natural Sciences,True
"Community Sustainability, Department of",Human Development and Family Sciences,Health,Health,False
"Kinesiology and Health, Department of","Exercise Science, Kinesiology, Rehab, Health",Health,Health,False
"History of Science, Department of",History,History,Humanities,False
"Media, Culture and Communication, Department of",Mass Communications and Media Studies,"Journalism, Media, Communication","Journalism, Media, Communication",False
"English, Department of",English Language and Literature,"Language, Literature, Culture",Humanities,False
"Education, School of",Education,Education,Education,False
"English and Comparative Literature, Department of",English Language and Literature,"Language, Literature, Culture",Humanities,False
"Visual Arts and Design, School of",,,,
"Art + Design, Department of",Art History and Criticism,"Language, Literature, Culture",Humanities,False
"Information Studies, School of",Information Science,Computational Sciences,Mathematics and Computing,True
"Urban Studies and Planning, Department of",Urban and Regional Planning,"Architecture, Design, Planning",Humanities,False
"Human and Organizational Development, School of",Human Development and Family Sciences,Health,Health,False
"International Affairs, School of",International Affairs,Political Science,Social Sciences,False
"Public Policy and Administration, School of",Public Policy,Public Administration and Policy,Public Administration and Policy,False
"Public Policy and Administration, School of",Public Administration,Public Administration and Policy,Public Administration and Policy,False
"Public and Environmental Affairs, School of",Public Policy,Public Administration and Policy,Public Administration and Policy,False
"Management and Organization, Department of",Management,Business,Business,False
"Accountancy, School of",Accounting,Business,Business,False
"Accounting, Fisher School of",Accounting,Business,Business,False
"Architecture, Department of",Architecture,"Architecture, Design, Planning",Humanities,False
"Building Construction, School of",Architecture,"Architecture, Design, Planning",Humanities,False
"Architecture, Planning and Landscape Architecture, School of",Architecture,"Architecture, Design, Planning",Humanities,False
"Economics, School of",Economics,Economics,Social Sciences,False
Political Science Department,Political Science,Political Science,Social Sciences,False
"Economics and Finance, Department of",Finance,Business,Business,False
"Economics and Finance, Department of",Economics,Economics,Social Sciences,False
"Economics, Finance and Legal Studies, Department of",Finance,Business,Business,False
"Economics, Finance and Legal Studies, Department of",Economics,Economics,Social Sciences,False
"Economics, Department of",Economics,Economics,Social Sciences,False
"Forestry and Wildlife Sciences, School of",Forestry and Forest Resources,Earth Sciences,Natural Sciences,True
"Forestry and Wildlife Sciences, School of",,Earth Sciences,Natural Sciences,True
"Health Administration and Policy, Department of",Public Health,Health,Health,False
"Modern Languages, School of",,"Language, Literature, Culture",Humanities,False
"Gender and Women's Studies, Department of",Gender Studies,Gender Studies,Social Sciences,False
"Theatre, Department of","Theatre Literature, History and Criticism","Language, Literature, Culture",Humanities,False
"Media and Cinema Studies, Department of",Mass Communications and Media Studies,"Journalism, Media, Communication","Journalism, Media, Communication",False
"Germanic Languages and Literatures, Department of",Germanic Languages and Literatures,"Language, Literature, Culture",Humanities,False
"International Studies, Department of",French Language and Literature,"Language, Literature, Culture",Humanities,False
"International Studies, Department of",Classics and Classical Languages,"Language, Literature, Culture",Humanities,False
"International Studies, Department of",Slavic Languages and Literatures,"Language, Literature, Culture",Humanities,False
