DepartmentName,Field,Area,Umbrella,is_STEM
"Public Affairs and Security Studies, Department of",Public Policy,Public Administration and Policy,Public Administration and Policy,False
"Health,Physical Education and Recreation, School of","Health, Physical Education, Recreation",Health,Health,False
"Supply Chain Management, Department of",Marketing,Business,Business,False
"Justice, Law and Criminology, Department of",Criminal Justice and Criminology,Sociology,Social Sciences,False
"Culture and Communication, Department of",Communication,"Journalism, Media, Communication","Journalism, Media, Communication",False
"Criminology & Justice Studies, Department of",Criminal Justice and Criminology,Sociology,Social Sciences,False
"Technological Entrepreneurship and Innovation Management, Department of",,Business,Business,False
"Agribusiness and Resource Management, Morrison School of",Business Administration,Business,Business,False
"Agribusiness and Resource Management, Morrison School of",Management,Business,Business,False
"Real Estate and Urban Land Economics, Department of",,Business,Business,False
"Legal Studies and Business Ethics, Department of",Philosophy,Philosophy,Humanities,False
"Business, College of",,Business,Business,False
"Language, Literacy and Intercultural Studies, Department of",Education,Education,Education,False
"Music, Department of",,,,
"Health Studies, School of","Health, Physical Education, Recreation",Health,Health,False
"Health Solutions, College of - Kinesiology, Sports and Exercise Science","Exercise Science, Kinesiology, Rehab, Health",Health,Health,False
"Family and Community Health Nursing, Department of",Nursing,Health,Health,False
"Mathematics and Applied Mathematics, Department of",,Mathematical Sciences,Mathematics and Computing,True
"Mathematics and Applied Mathematics, Department of",Mathematics,Mathematical Sciences,Mathematics and Computing,True
"Math and Statistics, Department of",Mathematics,Mathematical Sciences,Mathematics and Computing,True
"Math and Statistics, Department of",Statistics,Mathematical Sciences,Mathematics and Computing,True
"Infectious Diseases and Pathology, Department of",Veterinary Medical Sciences,Medical Sciences,Medicine,True
"Infectious Diseases and Pathology, Department of",Pathology,Biological Sciences,Natural Sciences,True
"Study of Biological Complexity, Center for the",,Biological Sciences,Natural Sciences,True
"Mathematics and Science Education, Department of",,Education,Education,False
"Biology and Ecology, School of",Ecology,Biological Sciences,Natural Sciences,True
"Biology and Ecology, School of",Biological Sciences,Biological Sciences,Natural Sciences,True
"Modern Languages and Comparative Literature, Department of",Comparative Literature,"Language, Literature, Culture",Humanities,False
"BioHealth Informatics, Department of",Information Science,Computational Sciences,Mathematics and Computing,True
"BioHealth Informatics, Department of",,Biological Sciences,Natural Sciences,True
"BioHealth Informatics, Department of",Information Technology,Computational Sciences,Mathematics and Computing,True
"Family Medicine, Department of",Public Health,Health,Health,False
"Communication Studies, Department of","Theatre Literature, History and Criticism","Language, Literature, Culture",Humanities,False
"Race, Ethnicity, Gender and Sexuality Studies, Department of",Gender Studies,Gender Studies,Social Sciences,False
"Marine and Environmental Affairs, School of",Marine Sciences,Earth Sciences,Natural Sciences,True
"Marine and Environmental Affairs, School of",Environmental Sciences,Earth Sciences,Natural Sciences,True
"Science, Mathematics and Social Science, Faculty of",,Education,Education,False
Philosophy Department,Philosophy,Philosophy,Humanities,False
"Agribusiness and Applied Economics, Department of",,Economics,Social Sciences,False
"Agribusiness and Applied Economics, Department of",Agricultural Economics,Economics,Social Sciences,False
"Agribusiness, Morrison School of",,Business,Business,False
Accounting Group (CoBA),Accounting,Business,Business,False
"Theatre, Film, and Digital Production,  Department of","Theatre Literature, History and Criticism","Language, Literature, Culture",Humanities,False
"Marketing, Information Systems, Information Assurance and Operations Management, Department of",Management Information Systems,Business,Business,False
"Marketing, Information Systems, Information Assurance and Operations Management, Department of",Marketing,Business,Business,False
"Sociology, Anthropology, and Social Work, Department of",Anthropology,Anthropology,Social Sciences,False
"Sociology, Anthropology, and Social Work, Department of",Sociology,Sociology,Social Sciences,False
"Sociology, Anthropology, and Social Work, Department of",Social Work,Health,Health,False
"Pharmaceutical Sciences, Department of",Pharmacology,Medical Sciences,Medicine,True
"Land, Air and Water Resources, Department of",Natural Resources,Earth Sciences,Natural Sciences,True
"Land, Air and Water Resources, Department of",Environmental Sciences,Earth Sciences,Natural Sciences,True
"Agricultural Economics and Agribusiness, Department of",Agricultural Economics,Economics,Social Sciences,False
"Civil, Environmental and Infrastructure Engineering, Department of",Civil Engineering,Engineering,Engineering,True
"Civil, Environmental and Infrastructure Engineering, Department of",Environmental Engineering,Engineering,Engineering,True
"Civil and Environmental Engineering and Engineering Mechanics, Department of",,Engineering,Engineering,True
"Civil and Environmental Engineering and Engineering Mechanics, Department of",Civil Engineering,Engineering,Engineering,True
"Civil and Environmental Engineering and Engineering Mechanics, Department of",Environmental Engineering,Engineering,Engineering,True
"Construction Management, Department of",Industrial Engineering,Engineering,Engineering,True
"Environmental, Agricultural and Occupational Health, Department of",Environmental Health Sciences,Health,Health,False
"Psychological and Quantitative Foundations, Department of",,Psychological Sciences,Social Sciences,False
"Ethnic Studies, Institute for",,"Language, Literature, Culture",Humanities,False
"Pharmacology and Experimental Neuroscience, Department of",Pharmaceutical Sciences,Medical Sciences,Medicine,True
"Pharmacology and Experimental Neuroscience, Department of",Pharmacology,Medical Sciences,Medicine,True
"Pharmacology and Experimental Neuroscience, Department of",Neuroscience,Biological Sciences,Natural Sciences,True
Environmental Studies Program,Environmental Sciences,Earth Sciences,Natural Sciences,True
"Ecology, Evolution and Behavior, Department of",Evolutionary Biology,Biological Sciences,Natural Sciences,True
"Ecology, Evolution and Behavior, Department of",Ecology,Biological Sciences,Natural Sciences,True
"Nutrition and Health Sciences, Department of",Nutrition Sciences,Health,Health,False
"Teaching, Learning and Teacher Education, Department of",,Education,Education,False
"Anthropology, Department of",Geography,Geography,Social Sciences,False
"Geosciences, Department of",Geography,Geography,Social Sciences,False
"Mathematical Sciences, Department of",,Education,Education,False
"Mathematical Sciences, Department of",Statistics,Mathematical Sciences,Mathematics and Computing,True
"Accountancy, Turner School of",Accounting,Business,Business,False
"Biology, Division of",Biological Sciences,Biological Sciences,Natural Sciences,True
"Pathology and Microbiology, Department of",Microbiology,Biological Sciences,Natural Sciences,True
"Pathology and Microbiology, Department of",Pathology,Biological Sciences,Natural Sciences,True
"Agronomy and Plant Genetics, Department of",Plant Sciences,Agriculture,Natural Sciences,True
"Agronomy and Plant Genetics, Department of",Agronomy,Agriculture,Natural Sciences,True
"Plants, Soils and Climate, Department of",Soil Science,Agriculture,Natural Sciences,True
"Plants, Soils and Climate, Department of",Plant Sciences,Agriculture,Natural Sciences,True
"Plants, Soils and Climate, Department of",Atmospheric Sciences and Meteorology,Physical Sciences,Natural Sciences,True
Landscape Architecture Program,,"Architecture, Design, Planning",Humanities,False
"Child, Youth and Family Studies, Department of",Human Development and Family Sciences,Health,Health,False
"Hospitality Management, Department of",,Business,Business,False
"Veterinary Microbiology and Pathology, Department of",Veterinary Medical Sciences,Medical Sciences,Medicine,True
"Molecular Virology and Microbiology, Department of",Microbiology,Biological Sciences,Natural Sciences,True
"Agricultural and Extension Education and Evaluation, Department of",,Agriculture,Natural Sciences,True
"Mechanical and Aerospace Engineering, Department of",Civil Engineering,Engineering,Engineering,True
"Chemical Engineering, Department of",Biomedical Engineering,Biological Sciences,Natural Sciences,True
"Applied Physical Sciences, Department of",,Physical Sciences,Natural Sciences,True
"Systems Science and Industrial Engineering, Department of",Systems Engineering,Engineering,Engineering,True
"Systems Science and Industrial Engineering, Department of",Industrial Engineering,Engineering,Engineering,True
"Physics and Optical Science, Department of",Physics,Physical Sciences,Natural Sciences,True
"Physics and Optical Science, Department of",,Physical Sciences,Natural Sciences,True
"Mining and Metallurgical Engineering, Department of",,Engineering,Engineering,True
"Textiles, Merchandising, and Fashion Design, Department of",,Health,Health,False
"Modern Languages and Literatures, Department of",,"Language, Literature, Culture",Humanities,False
"Teaching and Curriculum Leadership, School of",Education Administration,Education,Education,False
"Teaching and Curriculum Leadership, School of",Curriculum and Instruction,Education,Education,False
"Educational Theory and Practice, Department of",Curriculum and Instruction,Education,Education,False
"Educational Theory and Practice, Department of",Education,Education,Education,False
"Educational Theory and Practice, Department of",,Education,Education,False
"Molecular and Structural Biochemistry, Department of",Biochemistry,Biological Sciences,Natural Sciences,True
"Classics and Religious Studies, Department of",Classics and Classical Languages,"Language, Literature, Culture",Humanities,False
"Classics and Religious Studies, Department of",Religious Studies,Theology and Religion,Humanities,False
"Geography SNR, Department of",Geography,Geography,Social Sciences,False
"Applied Statistics and Operations Research, Department of",Operations Research,Engineering,Engineering,True
"Applied Statistics and Operations Research, Department of",Statistics,Mathematical Sciences,Mathematics and Computing,True
"Mathematical and Statistical Sciences, Department of",Statistics,Mathematical Sciences,Mathematics and Computing,True
"Mathematical and Statistical Sciences, Department of",Mathematics,Mathematical Sciences,Mathematics and Computing,True
"Mathematical and Statistical Sciences, Department of",,Mathematical Sciences,Mathematics and Computing,True
"Management, Department of",Marketing,Business,Business,False
"Business and Information Technology, Department of",Business Administration,Business,Business,False
"Business and Information Technology, Department of",Management Information Systems,Business,Business,False
"Marketing and Management, Department of",Management,Business,Business,False
"Marketing and Management, Department of",Marketing,Business,Business,False
"Computer Information Systems and Quantitative Methods, Department of",Computer Science,Computational Sciences,Mathematics and Computing,True
"Computer Information Systems and Quantitative Methods, Department of",Information Technology,Computational Sciences,Mathematics and Computing,True
"Educational Foundations, Leadership and Technology, Department of",,Education,Education,False
"Educational Foundations, Leadership and Technology, Department of",Education Administration,Education,Education,False
"Justice Sciences, Department of",Criminal Justice and Criminology,Sociology,Social Sciences,False
"Finance, Department of",Accounting,Business,Business,False
"News and Editorial, Department of",Mass Communications and Media Studies,"Journalism, Media, Communication","Journalism, Media, Communication",False
"Planning and Landscape Architecture, Department of",Urban and Regional Planning,"Architecture, Design, Planning",Humanities,False
"Planning and Landscape Architecture, Department of",Public Policy,Public Administration and Policy,Public Administration and Policy,False
"Planning and Landscape Architecture, Department of",Public Administration,Public Administration and Policy,Public Administration and Policy,False
"Industrial and Management Systems, Department of",Systems Engineering,Engineering,Engineering,True
"Industrial and Management Systems, Department of",Industrial Engineering,Engineering,Engineering,True
"Interior Architecture and Product Design, Department of",,"Architecture, Design, Planning",Humanities,False
"Broadcasting, Department of",Mass Communications and Media Studies,"Journalism, Media, Communication","Journalism, Media, Communication",False
"Survey Research and Methodology, Department of",,,,
"Bioengineering, Department of",,Engineering,Engineering,True
"Marketing and Supply Chain Management, Division of",Marketing,Business,Business,False
Supply Chain and Information Management Group (CoBA),Operations Research,Engineering,Engineering,True
Supply Chain and Information Management Group (CoBA),Management Information Systems,Business,Business,False
Supply Chain and Information Management Group (CoBA),Management,Business,Business,False
"Educational Psychology and Leadership, Department of",Educational Psychology,Psychological Sciences,Social Sciences,False
"Educational Psychology and Leadership, Department of",Education Administration,Education,Education,False
"Educational Psychology and Leadership, Department of",Counselor Education,Education,Education,False
Women's Studies and Gender Research Program,Gender Studies,Gender Studies,Social Sciences,False
"African-American and African Studies, Department of",,"Language, Literature, Culture",Humanities,False
"Accounting, Department of",Management Information Systems,Business,Business,False
"Accounting and Taxation, Department of",Accounting,Business,Business,False
"History and Geography, Department of",Geography,Geography,Social Sciences,False
"History and Geography, Department of",History,History,Humanities,False
"Art, Architecture, and Design, Department of",Architecture,"Architecture, Design, Planning",Humanities,False
"Modern Languages and Literature, Department of",,"Language, Literature, Culture",Humanities,False
"Ecology, Evolution and Natural Resources, Department of",Ecology,Biological Sciences,Natural Sciences,True
"Ecology, Evolution and Natural Resources, Department of",Evolutionary Biology,Biological Sciences,Natural Sciences,True
"Ecology, Evolution and Natural Resources, Department of",Natural Resources,Earth Sciences,Natural Sciences,True
"Plant, Soil, and Microbial Sciences, Department of",Soil Science,Agriculture,Natural Sciences,True
"Plant, Soil, and Microbial Sciences, Department of",Plant Pathology,Biological Sciences,Natural Sciences,True
"Plant, Soil, and Microbial Sciences, Department of",Agronomy,Agriculture,Natural Sciences,True
"Forestry, Department of",Forestry and Forest Resources,Earth Sciences,Natural Sciences,True
"Environmental and Forest Biology, Department of",Environmental Sciences,Earth Sciences,Natural Sciences,True
"Environmental and Forest Biology, Department of",Forestry and Forest Resources,Earth Sciences,Natural Sciences,True
"Pathobiology and Diagnostic Investigation, Department of",Veterinary Medical Sciences,Medical Sciences,Medicine,True
"Pathobiology and Diagnostic Investigation, Department of",Pathology,Biological Sciences,Natural Sciences,True
"Pharmacology, Toxicology and Therapeutics, Department of",Pharmacology,Medical Sciences,Medicine,True
"Pharmacology, Toxicology and Therapeutics, Department of",,Medical Sciences,Medicine,True
"Physiology and Cell Biology, Department of",Cell Biology,Biological Sciences,Natural Sciences,True
"Physiology and Cell Biology, Department of",Physiology,Medical Sciences,Medicine,True
"Veterinary Biosciences and Diagnostic Imaging, Department of",Veterinary Medical Sciences,Medical Sciences,Medicine,True
"Veterinary Population Medicine, Department of",Veterinary Medical Sciences,Medical Sciences,Medicine,True
"Educational Foundations, Organization, and Policy, Department of",Education,Education,Education,False
"Administrative and Policy Studies, Department of",Education Administration,Education,Education,False
"Integrative Biology, Department of",,Biological Sciences,Natural Sciences,True
"Management and Operations, Department of",Management,Business,Business,False
"Hearing and Speech, Department of",Speech and Hearing Sciences,Health,Health,False
"Communication Sciences and Special Education, Department of",Speech and Hearing Sciences,Health,Health,False
"Communication Sciences and Special Education, Department of",Communication Disorders and Sciences,Health,Health,False
"Communication Sciences and Special Education, Department of",Special Education,Education,Education,False
"Medical Microbiology and Immunology, Department of",Immunology,Medical Sciences,Medicine,True
"Medical Microbiology and Immunology, Department of",Microbiology,Biological Sciences,Natural Sciences,True
"Chemical & Biological Engineering, Department of",Agricultural Engineering,Engineering,Engineering,True
"Chemical & Biological Engineering, Department of",Chemical Engineering,Chemical Sciences,Natural Sciences,True
"Sustainable Bioproducts, Department of",Forestry and Forest Resources,Earth Sciences,Natural Sciences,True
"Languages and Linguistics, Department of",Linguistics,Linguistics,Humanities,False
"Languages and Linguistics, Department of",Spanish Language and Literature,"Language, Literature, Culture",Humanities,False
"Languages and Linguistics, Department of",French Language and Literature,"Language, Literature, Culture",Humanities,False
"Languages and Linguistics, Department of",Germanic Languages and Literatures,"Language, Literature, Culture",Humanities,False
"Cultural Studies, Department of",,,,
"Cultural Studies, Department of",Mass Communications and Media Studies,"Journalism, Media, Communication","Journalism, Media, Communication",False
"Romance and Classical Studies, Department of",Classics and Classical Languages,"Language, Literature, Culture",Humanities,False
"Horticultural Science, Department of",Horticulture,Agriculture,Natural Sciences,True
"Plant, Soil, and Environmental Sciences, Department of",Environmental Sciences,Earth Sciences,Natural Sciences,True
"Plant, Soil, and Environmental Sciences, Department of",Plant Sciences,Agriculture,Natural Sciences,True
"Plant, Soil, and Environmental Sciences, Department of",Soil Science,Agriculture,Natural Sciences,True
"Applied Ecology, Department of",Ecology,Biological Sciences,Natural Sciences,True
"Entertainment and Media Studies, Department of",Communication,"Journalism, Media, Communication","Journalism, Media, Communication",False
"Entertainment and Media Studies, Department of",Mass Communications and Media Studies,"Journalism, Media, Communication","Journalism, Media, Communication",False
"Information and Communications Systems, Department of",Management Information Systems,Business,Business,False
"Human Development and Quantitative Methodology, Department of",Human Development and Family Sciences,Health,Health,False
"Counseling, School, and Educational Psychology, Department of",Educational Psychology,Psychological Sciences,Social Sciences,False
"Counseling, School, and Educational Psychology, Department of",,Psychological Sciences,Social Sciences,False
"Applied Social Sciences, School of",Social Work,Health,Health,False
"Hospitality Business, School of",,Business,Business,False
"Clinical Studies, Department of (Philadelphia)",Veterinary Medical Sciences,Medical Sciences,Medicine,True
"Clinical Sciences, Department of (School of Veterinary Medicine)",Veterinary Medical Sciences,Medical Sciences,Medicine,True
"History and Art History, Department of",Art History and Criticism,"Language, Literature, Culture",Humanities,False
"History and Art History, Department of",History,History,Humanities,False
"Writing and Rhetoric, Department of",,"Language, Literature, Culture",Humanities,False
"Art, Art History, and Design, Department of",Art History and Criticism,"Language, Literature, Culture",Humanities,False
"Sustainable Communities, Program in",,,,
"Health Sciences, School of",,Health,Health,False
"Translational Neuroscience, Department of",Neuroscience,Biological Sciences,Natural Sciences,True
"Molecular Pharmacology and Physiology, Department of",Pharmacology,Medical Sciences,Medicine,True
"Molecular Pharmacology and Physiology, Department of",Physiology,Medical Sciences,Medicine,True
"Neuroscience, Division of",Neuroscience,Biological Sciences,Natural Sciences,True
"Veterinary and Microbiological Sciences, Department of",Veterinary Medical Sciences,Medical Sciences,Medicine,True
"Nutrition, Department of","Exercise Science, Kinesiology, Rehab, Health",Health,Health,False
"Vocal Studies, Department of",,,,
"Family and Child Sciences, Department of",Human Development and Family Sciences,Health,Health,False
"Human Centered Design and Engineering, Department of",Computer Science,Computational Sciences,Mathematics and Computing,True
"Languages, Philosophy and Speech Communication, Department of",Philosophy,Philosophy,Humanities,False
"Languages, Philosophy and Speech Communication, Department of",Communication,"Journalism, Media, Communication","Journalism, Media, Communication",False
"Animal and Nutritional Sciences, Division of",Animal Sciences,Agriculture,Natural Sciences,True
"Animal and Nutritional Sciences, Division of",Nutrition Sciences,Health,Health,False
"Applied Economics and Statistics, Department of",,Economics,Social Sciences,False
"Applied Economics and Statistics, Department of",Statistics,Mathematical Sciences,Mathematics and Computing,True
"Applied Economics and Statistics, Department of",Operations Research,Engineering,Engineering,True
"Applied Economics and Statistics, Department of",Agricultural Economics,Economics,Social Sciences,False
"Animal Sciences and Industry, Department of",Animal Sciences,Agriculture,Natural Sciences,True
"Sociology and Anthropology, Department of",Criminal Justice and Criminology,Sociology,Social Sciences,False
"Kinesiology and Sports Sciences, Department of","Exercise Science, Kinesiology, Rehab, Health",Health,Health,False
"Modern and Classical Languages and Literatures, Department of",,"Language, Literature, Culture",Humanities,False
"Systems Engineering and Operations Research, Department of",Operations Research,Engineering,Engineering,True
"Systems Engineering and Operations Research, Department of",Systems Engineering,Engineering,Engineering,True
"Computational Social Science, Department of",,,,
"Physics, Astronomy, and Computational Sciences, School of",Astronomy,Physical Sciences,Natural Sciences,True
"Physics, Astronomy, and Computational Sciences, School of",Physics,Physical Sciences,Natural Sciences,True
"Computational and Data Sciences, Department of",,Computational Sciences,Mathematics and Computing,True
"Management Science and Information Systems, Department of",Management Information Systems,Business,Business,False
"Decision Sciences, Department of",Operations Research,Engineering,Engineering,True
"Molecular Neuroscience, Department of",Neuroscience,Biological Sciences,Natural Sciences,True
"Atmospheric, Oceanic and Earth Sciences, Department of",Atmospheric Sciences and Meteorology,Physical Sciences,Natural Sciences,True
"Atmospheric, Oceanic and Earth Sciences, Department of",,Earth Sciences,Natural Sciences,True
"Atmospheric, Oceanic and Earth Sciences, Department of",Geology,Earth Sciences,Natural Sciences,True
"Coastal Sciences, Division of",,Earth Sciences,Natural Sciences,True
"Coastal Sciences, Division of",Marine Sciences,Earth Sciences,Natural Sciences,True
Education Policy Division,Education Administration,Education,Education,False
"Health and Human Development, Department of",,Psychological Sciences,Social Sciences,False
"Health and Human Development, Department of","Health, Physical Education, Recreation",Health,Health,False
"Theory and Practice In Teacher Education, Department of",,Education,Education,False
"Elementary and Early Childhood Education, Department of",,Education,Education,False
"Reading and Elementary Education, Department of",,Education,Education,False
"Theater, School of","Theatre Literature, History and Criticism","Language, Literature, Culture",Humanities,False
"Applied Health Sciences and Wellness, School of","Exercise Science, Kinesiology, Rehab, Health",Health,Health,False
"Applied Health Sciences and Wellness, School of","Health, Physical Education, Recreation",Health,Health,False
"Language and Literature, Department of",English Language and Literature,"Language, Literature, Culture",Humanities,False
"Language and Literature, Department of",Spanish Language and Literature,"Language, Literature, Culture",Humanities,False
"Language and Literature, Department of",French Language and Literature,"Language, Literature, Culture",Humanities,False
Business School - Marketing,Marketing,Business,Business,False
"Nutrition and Food Studies, Department of",Nutrition Sciences,Health,Health,False
"Nutrition and Food Studies, Department of",Food Science,Agriculture,Natural Sciences,True
"Rehabilitation Science, Department of","Exercise Science, Kinesiology, Rehab, Health",Health,Health,False
"Humanities and Social Sciences, Department of",,,,
