DepartmentName,Field,Area,Umbrella,is_STEM
"Biomolecular Chemistry, Department of",Biochemistry,Biological Sciences,Natural Sciences,True
"Engineering Professional Development, Department of",,Engineering,Engineering,True
"Comparative Literature and Folklore Studies, Department of",Comparative Literature,"Language, Literature, Culture",Humanities,False
"Cell Biology, Neurobiology and Anatomy, Department of",Anatomy,Biological Sciences,Natural Sciences,True
"Cell Biology, Neurobiology and Anatomy, Department of",Cell Biology,Biological Sciences,Natural Sciences,True
"Cell Biology, Neurobiology and Anatomy, Department of",Neuroscience,Biological Sciences,Natural Sciences,True
"Cell and Regenerative Biology, Department of",Cell Biology,Biological Sciences,Natural Sciences,True
"Medical Physics, Department of",Physics,Physical Sciences,Natural Sciences,True
"Greek and Latin, Department of",Classics and Classical Languages,"Language, Literature, Culture",Humanities,False
"Community and Environmental Sociology, Department of",Sociology,Sociology,Social Sciences,False
Environmental Science and Engineering Area,Environmental Engineering,Engineering,Engineering,True
Environmental Science and Engineering Area,Environmental Sciences,Earth Sciences,Natural Sciences,True
"Global and International Studies, Department of",International Affairs,Political Science,Social Sciences,False
"Biological Sciences - Cell and Developmental Biology, Section of",Cell Biology,Biological Sciences,Natural Sciences,True
"Biological Sciences - Cell and Developmental Biology, Section of",,Biological Sciences,Natural Sciences,True
"Oncology, Department of",,Medical Sciences,Medicine,True
"Educational Leadership, Policy, and Foundations, Department of",Education Administration,Education,Education,False
"Marine and Coastal Sciences, Department of",Marine Sciences,Earth Sciences,Natural Sciences,True
"Agriculture, Food, and Environment, Division of",Food Science,Agriculture,Natural Sciences,True
"Human and Organizational Development, Department of",Social Work,Health,Health,False
"Human and Organizational Development, Department of",Human Development and Family Sciences,Health,Health,False
"Scandinavian Studies, Department of",,"Language, Literature, Culture",Humanities,False
"Comparative Arts and Letters, Department of",Comparative Literature,"Language, Literature, Culture",Humanities,False
"Comparative Arts and Letters, Department of",Classics and Classical Languages,"Language, Literature, Culture",Humanities,False
"Comparative Arts and Letters, Department of",,,,
"Earth and Environmental Sciences, Department of",Ecology,Biological Sciences,Natural Sciences,True
"Clinical and Administrative Pharmacy, Department of",Pharmacy,Medical Sciences,Medicine,True
"Plant, Soil and Entomological Sciences, Department of",Plant Sciences,Agriculture,Natural Sciences,True
"Plant, Soil and Entomological Sciences, Department of",Soil Science,Agriculture,Natural Sciences,True
"Plant, Soil and Entomological Sciences, Department of",Entomology,Biological Sciences,Natural Sciences,True
"Statistics, Division of",Statistics,Mathematical Sciences,Mathematics and Computing,True
"Human Oncology, Department of",,Medical Sciences,Medicine,True
"Genetics, Cell Biology and Anatomy, Department of",Cell Biology,Biological Sciences,Natural Sciences,True
"Genetics, Cell Biology and Anatomy, Department of",Anatomy,Biological Sciences,Natural Sciences,True
"Genetics, Cell Biology and Anatomy, Department of",Genetics,Medical Sciences,Medicine,True
"Medical Sciences, Department of",Veterinary Medical Sciences,Medical Sciences,Medicine,True
"Engineering Technology, Department of",,"Architecture, Design, Planning",Humanities,False
"Bio-Engineering, Department of",Agricultural Engineering,Engineering,Engineering,True
"School Psychology, Higher Education and Counselor Education, Department of",Speech and Hearing Sciences,Health,Health,False
"School Psychology, Higher Education and Counselor Education, Department of",Counselor Education,Education,Education,False
"School Psychology, Higher Education and Counselor Education, Department of",,Psychological Sciences,Social Sciences,False
"School Psychology, Higher Education and Counselor Education, Department of",,Education,Education,False
"Criminal Justice, Social Work and Legal Specialties, Department of",Criminal Justice and Criminology,Sociology,Social Sciences,False
"Criminal Justice, Social Work and Legal Specialties, Department of",Social Work,Health,Health,False
"Educational Studies, Department of",Curriculum and Instruction,Education,Education,False
"Early Childhood Physical and Special Education, Department of",Special Education,Education,Education,False
"Early Childhood Physical and Special Education, Department of",,Education,Education,False
"Counseling and Psychology In Education, Department of",Counselor Education,Education,Education,False
"Counseling and Psychology In Education, Department of",,Psychological Sciences,Social Sciences,False
Graduate School of Education - Division of Psychological and Educational Services,Educational Psychology,Psychological Sciences,Social Sciences,False
School Psychology Program,,Psychological Sciences,Social Sciences,False
"Population Health, School of",Public Health,Health,Health,False
"Health Professions, Department of",,Health,Health,False
"Biochemistry and Cancer Biology, Department of",,Medical Sciences,Medicine,True
"Biochemistry and Cancer Biology, Department of",Biochemistry,Biological Sciences,Natural Sciences,True
"Educational, School, and Counseling Psychology, Department of",,Psychological Sciences,Social Sciences,False
"Educational, School, and Counseling Psychology, Department of",Educational Psychology,Psychological Sciences,Social Sciences,False
"Rehabilitation, Social Work and Addictions, Department of",Social Work,Health,Health,False
"Administration of Justice, Department of",Criminal Justice and Criminology,Sociology,Social Sciences,False
"Psychology, Department of",Anthropology,Anthropology,Social Sciences,False
"Medicinal and Biological Chemistry, Department of",Pharmaceutical Sciences,Medical Sciences,Medicine,True
"Geography  and Planning, Department of",Urban and Regional Planning,"Architecture, Design, Planning",Humanities,False
"Geography  and Planning, Department of",Geography,Geography,Social Sciences,False
"Applied Organizational Technology, Department of",,Business,Business,False
Chemistry Department,Chemistry,Chemical Sciences,Natural Sciences,True
"Journalism and Graphic Communication, School of",Mass Communications and Media Studies,"Journalism, Media, Communication","Journalism, Media, Communication",False
"Molecular Biology and Microbiology, Department of",Microbiology,Biological Sciences,Natural Sciences,True
"Molecular Biology and Microbiology, Department of",Molecular Biology,Biological Sciences,Natural Sciences,True
"Operations, Department of",Operations Research,Engineering,Engineering,True
"Human Resource Studies, Department of",Management,Business,Business,False
"Health Informatics and Information Management, Department of",,Health,Health,False
"Retailing, Department of",,Health,Health,False
"Library and Information Studies, Department of",Information Science,Computational Sciences,Mathematics and Computing,True
"Epidemiology and Prevention, Department of",Epidemiology,Medical Sciences,Medicine,True
"Epidemiology and Prevention, Department of",Public Health,Health,Health,False
"Estuarine and Ocean Sciences, Department of",,Earth Sciences,Natural Sciences,True
"Exercise and Sport Science, Department of","Exercise Science, Kinesiology, Rehab, Health",Health,Health,False
"Microbiology, Immunology and Cell Biology, Department of",Microbiology,Biological Sciences,Natural Sciences,True
"Microbiology, Immunology and Cell Biology, Department of",Cell Biology,Biological Sciences,Natural Sciences,True
"Microbiology, Immunology and Cell Biology, Department of",Immunology,Medical Sciences,Medicine,True
"Pharmacology, Physiology and Neuroscience, Department of",Neuroscience,Biological Sciences,Natural Sciences,True
"Pharmacology, Physiology and Neuroscience, Department of",Physiology,Medical Sciences,Medicine,True
"Pharmacology, Physiology and Neuroscience, Department of",Pharmacology,Medical Sciences,Medicine,True
"Clinical Pharmacy and Outcomes Sciences (CPOS), Department of",Pharmacy,Medical Sciences,Medicine,True
"Drug Discovery and Biomedical Sciences (DDBS), Department of",Pharmaceutical Sciences,Medical Sciences,Medicine,True
"Dance, Division of",,,,
"Chemical Engineering, Department of",Materials Engineering,Engineering,Engineering,True
"Chemical Engineering, Department of",Environmental Engineering,Engineering,Engineering,True
"Russian Literature, Department of",Slavic Languages and Literatures,"Language, Literature, Culture",Humanities,False
"Radio/Television/Film, Department of",Mass Communications and Media Studies,"Journalism, Media, Communication","Journalism, Media, Communication",False
"Cultural Foundations of Education, Department of",,Education,Education,False
"History of Art and Visual Studies, Department of",Art History and Criticism,"Language, Literature, Culture",Humanities,False
"Labor Studies and Employment Relations, Department of",,Business,Business,False
"Latin American and Latino Studies, Department of",,"Language, Literature, Culture",Humanities,False
"Genetic Medicine, Department of",Genetics,Medical Sciences,Medicine,True
"Genetic Medicine, Department of",,Medical Sciences,Medicine,True
"Neurobiology and Behavior, Department of",,Biological Sciences,Natural Sciences,True
"Architectural Studies, Department of",Architecture,"Architecture, Design, Planning",Humanities,False
"Molecular Medicine, Department of",Veterinary Medical Sciences,Medical Sciences,Medicine,True
"Molecular Medicine, Department of",Pharmacology,Medical Sciences,Medicine,True
"Polymer and Fiber Engineering, Department of",Materials Engineering,Engineering,Engineering,True
"Management and International Business, Division of",Management,Business,Business,False
"Public and Nonprofit Administration, Department of",Public Administration,Public Administration and Policy,Public Administration and Policy,False
"Marketing, Area in",Marketing,Business,Business,False
"Supply Chain, Operations Management, and Business Statistics, Area in",,Business,Business,False
"Information Technology, Analytics, and Operations, Department of",Information Technology,Computational Sciences,Mathematics and Computing,True
"Writing Studies, Rhetoric and Composition",,"Language, Literature, Culture",Humanities,False
"Drama and Dance, Department of",,,,
"Occupational Science & Technology, Department of","Exercise Science, Kinesiology, Rehab, Health",Health,Health,False
"Modern Dance, Department of",,,,
"Freshwater Sciences, School of",Natural Resources,Earth Sciences,Natural Sciences,True
"Freshwater Sciences, School of",Environmental Sciences,Earth Sciences,Natural Sciences,True
"Freshwater Sciences, School of",,Earth Sciences,Natural Sciences,True
"Mathematics, Department of",,Computational Sciences,Mathematics and Computing,True
"Population Health, Department of",Public Health,Health,Health,False
"Environmental Sustainability, Institute of",Environmental Sciences,Earth Sciences,Natural Sciences,True
"Environmental Sustainability, Institute of",Natural Resources,Earth Sciences,Natural Sciences,True
"Political Science and International Relations, Department of",International Affairs,Political Science,Social Sciences,False
"Political Science and International Relations, Department of",Political Science,Political Science,Social Sciences,False
"Health Informatics & Administration, Department of",,Health,Health,False
"Educational Policy and Community Studies,  Department of",Education Administration,Education,Education,False
"Engineering and Technology, Department of",,Engineering,Engineering,True
"Social and Cultural Sciences, Department of",,,,
"French, Italian, and Comparative Literature, Department of",Comparative Literature,"Language, Literature, Culture",Humanities,False
"French, Italian, and Comparative Literature, Department of",French Language and Literature,"Language, Literature, Culture",Humanities,False
"French, Italian, and Comparative Literature, Department of",,"Language, Literature, Culture",Humanities,False
"Africology, Department of",,"Language, Literature, Culture",Humanities,False
"Film, Department of",Mass Communications and Media Studies,"Journalism, Media, Communication","Journalism, Media, Communication",False
Real Estate Program,,Business,Business,False
"Real Estate, School of",,Business,Business,False
Integrated Business Program,,Business,Business,False
"Public Affairs, Department of",Public Policy,Public Administration and Policy,Public Administration and Policy,False
"English and Language Arts, Department of",English Language and Literature,"Language, Literature, Culture",Humanities,False
"Music, Division of",Music,Arts,Humanities,False
"Computing and Informatics, School of",Computer Science,Computational Sciences,Mathematics and Computing,True
"Computing and Informatics, School of",Information Science,Computational Sciences,Mathematics and Computing,True
"Computing and Informatics, School of",,Computational Sciences,Mathematics and Computing,True
"Computing and Informatics, School of",Computer Engineering,Computational Sciences,Mathematics and Computing,True
"Computing and Informatics, School of",Information Technology,Computational Sciences,Mathematics and Computing,True
"Teaching, Learning, and Leadership, School of",Curriculum and Instruction,Education,Education,False
"Teaching, Learning, and Leadership, School of",Education Administration,Education,Education,False
"Kinesiology and Physical Therapy, School of","Exercise Science, Kinesiology, Rehab, Health",Health,Health,False
Management Department,Management,Business,Business,False
"Emergency Management, Department of",Public Health,Health,Health,False
"Clinical Health Sciences, Department of",Communication Disorders and Sciences,Health,Health,False
"Clinical Health Sciences, Department of",Social Work,Health,Health,False
"Industrial and Management Systems Engineering, Department of",Systems Engineering,Engineering,Engineering,True
"Industrial and Management Systems Engineering, Department of",Industrial Engineering,Engineering,Engineering,True
"Human Nutrition and Hospitality Management, Department of",Nutrition Sciences,Health,Health,False
"Teaching, Learning and Innovation, Department of",Curriculum and Instruction,Education,Education,False
"Chemical, Materials and Biomedical Engineering, School of",Chemical Engineering,Chemical Sciences,Natural Sciences,True
"Chemical, Materials and Biomedical Engineering, School of",Biomedical Engineering,Biological Sciences,Natural Sciences,True
"Chemical, Materials and Biomedical Engineering, School of",Materials Engineering,Engineering,Engineering,True
"Sport Business Management, School of",,Business,Business,False
"Accounting, Joseph I. Lubin School of",Accounting,Business,Business,False
"Information and Logistics Technology, Department of",Information Technology,Computational Sciences,Mathematics and Computing,True
"Biochemistry & Molecular Biology, Department of (New Jersey Medical School)",Biochemistry,Biological Sciences,Natural Sciences,True
"Biochemistry & Molecular Biology, Department of (New Jersey Medical School)",Molecular Biology,Biological Sciences,Natural Sciences,True
"Neuroscience and Cell Biology, Department of",Neuroscience,Biological Sciences,Natural Sciences,True
"Neuroscience and Cell Biology, Department of",Cell Biology,Biological Sciences,Natural Sciences,True
"African, Middle Eastern and South Asian Languages and Literatures, Department of",,"Language, Literature, Culture",Humanities,False
"Preventive Medicine and Community Health, Department of","Exercise Science, Kinesiology, Rehab, Health",Health,Health,False
"Preventive Medicine and Community Health, Department of",Public Health,Health,Health,False
"Quantitative Methods: Epidemiology and Biostatistics, Department of",Biostatistics,Biological Sciences,Natural Sciences,True
"Quantitative Methods: Epidemiology and Biostatistics, Department of",Epidemiology,Medical Sciences,Medicine,True
"Pharmacy Practice and Administration, Department of",Pharmacy,Medical Sciences,Medicine,True
"Neurology and Neurosciences, Department of",Neuroscience,Biological Sciences,Natural Sciences,True
"Hispanic and Italian Studies, Department of",Spanish Language and Literature,"Language, Literature, Culture",Humanities,False
"Hispanic and Italian Studies, Department of",,"Language, Literature, Culture",Humanities,False
"Biochemistry and Molecular Biology, Department of (Robert Wood Johnson Medical School)",Molecular Biology,Biological Sciences,Natural Sciences,True
"Biochemistry and Molecular Biology, Department of (Robert Wood Johnson Medical School)",Biochemistry,Biological Sciences,Natural Sciences,True
"Biochemistry & Molecular Biology, Department of (Robert Wood Johnson Medical School)",Molecular Biology,Biological Sciences,Natural Sciences,True
"Biochemistry & Molecular Biology, Department of (Robert Wood Johnson Medical School)",Biochemistry,Biological Sciences,Natural Sciences,True
"Chemical Biology, Department of",,Chemical Sciences,Natural Sciences,True
"Chemical Biology, Deptartment of",Biochemistry,Biological Sciences,Natural Sciences,True
"Molecular Genetics and Microbiology, Department of",Immunology,Medical Sciences,Medicine,True
"Educational Theory, Policy and Administration, Department of",Education Administration,Education,Education,False
"Health Education and Behavioral Science, Department of","Exercise Science, Kinesiology, Rehab, Health",Health,Health,False
"Health Education and Behavioral Science, Department of","Health, Physical Education, Recreation",Health,Health,False
"Pathology and Laboratory Medicine, Department of (Robert Wood Johnson Medical School)",Pathology,Biological Sciences,Natural Sciences,True
"Pathology and Laboratory medicine, Department of (Robert Wood Johnson Medical School)",Pathology,Biological Sciences,Natural Sciences,True
"Criminal Justice, Program in",Criminal Justice and Criminology,Sociology,Social Sciences,False
"Business, School of (Syms)",Business Administration,Business,Business,False
"Business, School of (Syms)",Management,Business,Business,False
"Cellular and Structural Biology, Department of",Cell Biology,Biological Sciences,Natural Sciences,True
"Cellular and Structural Biology, Department of",,Chemical Sciences,Natural Sciences,True
"Urban Health Administration, Department of",Public Health,Health,Health,False
"Arts, Culture and Media, Department of",Art History and Criticism,"Language, Literature, Culture",Humanities,False
"Strategic Management, Department of",Business Administration,Business,Business,False
"Strategic Management, Department of",Management,Business,Business,False
"Health Informatics, Department of",,Health,Health,False
"Urban Education, Department of",Education Administration,Education,Education,False
"Urban Education, Department of",Public Policy,Public Administration and Policy,Public Administration and Policy,False
Management Science Area,Management,Business,Business,False
"Mathematics and Statistical Sciences, Department of",Statistics,Mathematical Sciences,Mathematics and Computing,True
"Mathematics and Statistical Sciences, Department of",Mathematics,Mathematical Sciences,Mathematics and Computing,True
"Science/Mathematics Education, Department of",,Education,Education,False
"Hispanic Languages and Literatures, Department of",Spanish Language and Literature,"Language, Literature, Culture",Humanities,False
"Economics (Scw), Department of",Economics,Economics,Social Sciences,False
"Philosophy (Scw), Department of",Philosophy,Philosophy,Humanities,False
"Computer Applications, Department of",Computer Science,Computational Sciences,Mathematics and Computing,True
"Theology and Religious Studies, School of",Religious Studies,Theology and Religion,Humanities,False
"Theology and Religious Studies, School of",Theological Studies,Theology and Religion,Humanities,False
"Immunology and Infectious Diseases, Department of",Immunology,Medical Sciences,Medicine,True
"Physical Medicine and Rehabilitation , Department of","Exercise Science, Kinesiology, Rehab, Health",Health,Health,False
"Biomedical Informatics, Department of",Biostatistics,Biological Sciences,Natural Sciences,True
"Spanish and Portuguese Languages and Cultures, Department of",Spanish Language and Literature,"Language, Literature, Culture",Humanities,False
"Technology and Society, Department of",,,,
"Inner Asian and Altaic Studies, Committee on",,"Language, Literature, Culture",Humanities,False
"Public Policy and Public Affairs, Department of",Public Policy,Public Administration and Policy,Public Administration and Policy,False
"Biological Sciences - Molecular Biology, Section of",Molecular Biology,Biological Sciences,Natural Sciences,True
"Community Health, Department of",Public Health,Health,Health,False
"Health Research and Policy, Department of",Biostatistics,Biological Sciences,Natural Sciences,True
"Health Research and Policy, Department of",Epidemiology,Medical Sciences,Medicine,True
"Health Research and Policy, Department of",Public Health,Health,Health,False
"Marketing, Area of",Marketing,Business,Business,False
"Systems Biology, Department of",Biological Sciences,Biological Sciences,Natural Sciences,True
"Divinity - Religions in America, Department of",Theological Studies,Theology and Religion,Humanities,False
"Divinity - Theology, Department of",Theological Studies,Theology and Religion,Humanities,False
"Divinity - Theology, Department of",Religious Studies,Theology and Religion,Humanities,False
"Preventive Medicine, Department of",Public Health,Health,Health,False
"Preventive Medicine, Department of",Epidemiology,Medical Sciences,Medicine,True
"Biology, Department of",,Medical Sciences,Medicine,True
"Biology, Department of",Physiology,Medical Sciences,Medicine,True
"Biology, Department of",Immunology,Medical Sciences,Medicine,True
"Biology, Department of",Biochemistry,Biological Sciences,Natural Sciences,True
"Health Behavior and Health Education, Department of",Public Health,Health,Health,False
"Media Arts and Sciences, Program in",Mass Communications and Media Studies,"Journalism, Media, Communication","Journalism, Media, Communication",False
"Oral Health Policy and Epidemiology, School of Dental Medicine",Public Health,Health,Health,False
"Oral Health Sciences, Department of",,Medical Sciences,Medicine,True
"Cognitive and Neural Systems, Department of",,Biological Sciences,Natural Sciences,True
"Cognitive and Neural Systems, Department of",Neuroscience,Biological Sciences,Natural Sciences,True
"History , Department of",History,History,Humanities,False
"Mechanical Engineering, Program in",Mechanical Engineering,Engineering,Engineering,True
"Electrical and Biomedical Engineering, Department of",Computer Engineering,Computational Sciences,Mathematics and Computing,True
"Communication Sciences and Disorders, Department of",Speech and Hearing Sciences,Health,Health,False
"Geography and Environment, Department of",Geography,Geography,Social Sciences,False
"Environmental, Earth and Ocean Sciences, Department of",Environmental Sciences,Earth Sciences,Natural Sciences,True
"Environmental, Earth and Ocean Sciences, Department of",Geology,Earth Sciences,Natural Sciences,True
"Environmental, Earth and Ocean Sciences, Department of",,Earth Sciences,Natural Sciences,True
"Physiology and Developmental Biology, Department of",,Biological Sciences,Natural Sciences,True
"Physiology and Developmental Biology, Department of",Physiology,Medical Sciences,Medicine,True
"Integrative Physiology and Pathobiology, Department of",Physiology,Medical Sciences,Medicine,True
"Integrative Physiology and Pathobiology, Department of",Pathology,Biological Sciences,Natural Sciences,True
"Architectural History, Department of",,"Architecture, Design, Planning",Humanities,False
"Archaeology, Department of",Anthropology,Anthropology,Social Sciences,False
"Archaeology, Department of",,"Language, Literature, Culture",Humanities,False
"Bioethics and Humanities, Department of",Philosophy,Philosophy,Humanities,False
"Health Law, Bioethics and Human Rights, Department of",Philosophy,Philosophy,Humanities,False
"Statistics and Actuarial Science, Department of",Statistics,Mathematical Sciences,Mathematics and Computing,True
"Social Thought, Committee on",,,,
"Religion and Classics, Department of",Religious Studies,Theology and Religion,Humanities,False
"Religion and Classics, Department of",Classics and Classical Languages,"Language, Literature, Culture",Humanities,False
"Film and Television, Department of",Mass Communications and Media Studies,"Journalism, Media, Communication","Journalism, Media, Communication",False
"Middle Eastern and South Asian Languages and Cultures, Department of",Near and Middle Eastern Languages and Cultures,"Language, Literature, Culture",Humanities,False
"Classical and Near Eastern Languages and Civilizations, Department of",Near and Middle Eastern Languages and Cultures,"Language, Literature, Culture",Humanities,False
"Classical and Near Eastern Languages and Civilizations, Department of",Classics and Classical Languages,"Language, Literature, Culture",Humanities,False
"Languages, Literature and Culture, Department of",,"Language, Literature, Culture",Humanities,False
Creative Writing,,"Language, Literature, Culture",Humanities,False
"Manpower and Economics, Department of",Economics,Economics,Social Sciences,False
"Management, Area of",Management,Business,Business,False
"Finance, Area of",Finance,Business,Business,False
"Science and Mathematics Education, Department of",,Education,Education,False
"Stem Education and Professional Studies, Department of",,Education,Education,False
