DepartmentName,Field,Area,Umbrella,is_STEM
"Learning and Instruction, Department of",Curriculum and Instruction,Education,Education,False
"Counseling and Educational Development, Department of",Counselor Education,Education,Education,False
"Educational, School and Counseling Psychology, Department of",Educational Psychology,Psychological Sciences,Social Sciences,False
"Educational, School and Counseling Psychology, Department of",,Psychological Sciences,Social Sciences,False
"Psychological, Health, and Learning, Department of",Educational Psychology,Psychological Sciences,Social Sciences,False
"Theoretical and Behavioral Foundations, Division of",,Education,Education,False
"Psychology and Behavioral Sciences, Department of",Psychology,Psychological Sciences,Social Sciences,False
"Leadership, Educational Psychology and Foundations, Department of",Educational Psychology,Psychological Sciences,Social Sciences,False
"Leadership, Educational Psychology and Foundations, Department of",,Education,Education,False
"Leadership, Educational Psychology and Foundations, Department of",Education Administration,Education,Education,False
"Atmospheric Sciences, Department of",Atmospheric Sciences and Meteorology,Physical Sciences,Natural Sciences,True
"Marine and Atmospheric Sciences (SoMAS), School of",Marine Sciences,Earth Sciences,Natural Sciences,True
"Marine and Atmospheric Sciences (SoMAS), School of",Atmospheric Sciences and Meteorology,Physical Sciences,Natural Sciences,True
"Earth, Atmospheric and Planetary Sciences, Department of",Geology,Earth Sciences,Natural Sciences,True
"Earth, Atmospheric and Planetary Sciences, Department of",Atmospheric Sciences and Meteorology,Physical Sciences,Natural Sciences,True
"Plant Science and Landscape Architecture, Department of",Plant Sciences,Agriculture,Natural Sciences,True
"Environmental Science and Technology, Department of",Environmental Sciences,Earth Sciences,Natural Sciences,True
"Plant and Soil Sciences, Department of",Plant Sciences,Agriculture,Natural Sciences,True
"Plant and Soil Sciences, Department of",Soil Science,Agriculture,Natural Sciences,True
"Earth Science, Department of",Geology,Earth Sciences,Natural Sciences,True
"Computational and Applied Mathematics, Department of",,Computational Sciences,Mathematics and Computing,True
"Computational and Applied Mathematics, Department of",,Mathematical Sciences,Mathematics and Computing,True
"Mathematics, Statistics and Computer Science, Department of",Computer Science,Computational Sciences,Mathematics and Computing,True
"Mathematics, Statistics and Computer Science, Department of",Mathematics,Mathematical Sciences,Mathematics and Computing,True
"Mathematics, Statistics and Computer Science, Department of",Statistics,Mathematical Sciences,Mathematics and Computing,True
"Biomedical Science and Pathobiology, Department of",Veterinary Medical Sciences,Medical Sciences,Medicine,True
"Biomedical Science and Pathobiology, Department of",,Biological Sciences,Natural Sciences,True
"Veterinary Pathobiology, Department of",Veterinary Medical Sciences,Medical Sciences,Medicine,True
"Diagnostic Medicine/Pathobiology, Department of",Pathology,Biological Sciences,Natural Sciences,True
"Veterinary Clinical Sciences, Department of",Veterinary Medical Sciences,Medical Sciences,Medicine,True
"Aviation Technology, Department of",Aerospace Engineering,Engineering,Engineering,True
"Public Health, Department of",Public Health,Health,Health,False
"Agricultural and Consumer Economics, Department of",Agricultural Economics,Economics,Social Sciences,False
"Agricultural and Consumer Economics, Department of",Human Development and Family Sciences,Health,Health,False
"Agricultural and Applied Economics, Department of",Agricultural Economics,Economics,Social Sciences,False
"Agricultural and Applied Economics, Department of",,Economics,Social Sciences,False
"Forestry and Natural Resources, Department of",Natural Resources,Earth Sciences,Natural Sciences,True
"Forestry and Natural Resources, Department of",Forestry and Forest Resources,Earth Sciences,Natural Sciences,True
"Food, Bioprocessing and Nutrition Sciences, Department of",Food Science,Agriculture,Natural Sciences,True
"Food, Bioprocessing and Nutrition Sciences, Department of",Nutrition Sciences,Health,Health,False
"Dairy Science, Department of",Animal Sciences,Agriculture,Natural Sciences,True
"Dairy Science, Department of",Food Science,Agriculture,Natural Sciences,True
"Agriculture and Food Sciences, College of",Food Science,Agriculture,Natural Sciences,True
"Veterinary Clinical Medicine, Department of",Veterinary Medical Sciences,Medical Sciences,Medicine,True
"Clinical Sciences, Department of",Veterinary Medical Sciences,Medical Sciences,Medicine,True
"Small Animal Clinical Sciences, Department of",Veterinary Medical Sciences,Medical Sciences,Medicine,True
"Surgical and Radiological Sciences, Department of",Veterinary Medical Sciences,Medical Sciences,Medicine,True
"Digital Media and Design, Department of",,,,
"Retail, Hospitality and Tourism Management, Department of",,Business,Business,False
"Hospitality and Tourism Management, Department of",,Business,Business,False
"Business, Stuart School of",Management,Business,Business,False
"Business, Stuart School of",Business Administration,Business,Business,False
"Family and Consumer Sciences, School of",,Health,Health,False
"Family, Consumer and Human Development, Department of",Human Development and Family Sciences,Health,Health,False
"Technology, School of",,Engineering,Engineering,True
"Technology, School of",,Business,Business,False
"Administrative Leadership, Department of",Education Administration,Education,Education,False
"Workforce Education and Development, Department of",,Education,Education,False
"Organizational Leadership and Supervision, Department of",Management,Business,Business,False
"Leadership and Human Resource Development, School of",,Business,Business,False
"Computer and Information Technology, Department of",Computer Science,Computational Sciences,Mathematics and Computing,True
"Computer and Information Technology, Department of",Information Science,Computational Sciences,Mathematics and Computing,True
"Computer and Information Technology, Department of",Information Technology,Computational Sciences,Mathematics and Computing,True
"Computer Graphics Technology, Department of",Computer Science,Computational Sciences,Mathematics and Computing,True
"Accounting and Finance, Department of",Finance,Business,Business,False
"Accounting and Finance, Department of",Accounting,Business,Business,False
"Management Sciences, Department of",Management,Business,Business,False
"Business, Leeds School - Management and Entrepreneurship Division",Management,Business,Business,False
"Finance, Insurance and Business Law, Department of",Finance,Business,Business,False
"Human Resources and Labor Relations, School of",,Business,Business,False
"Business Analytics and Statistics, Department of",Management Information Systems,Business,Business,False
"Business Analytics and Statistics, Department of",Statistics,Mathematical Sciences,Mathematics and Computing,True
"Business Analytics and Statistics, Department of",Operations Research,Engineering,Engineering,True
"Business Analytics and Statistics, Department of",Management,Business,Business,False
"Supply Chain and Information Systems, Department of",Management Information Systems,Business,Business,False
"Informatics, Computing, and Cyber Systems, School of",Computer Science,Computational Sciences,Mathematics and Computing,True
"Informatics, Computing, and Cyber Systems, School of",Information Science,Computational Sciences,Mathematics and Computing,True
"Informatics, Computing, and Cyber Systems, School of",,Computational Sciences,Mathematics and Computing,True
"Informatics, Computing, and Cyber Systems, School of",Information Technology,Computational Sciences,Mathematics and Computing,True
"Management Science, Department of",Management,Business,Business,False
"Management and Information Systems, Department of",Management Information Systems,Business,Business,False
"Information, Risk, and Operations Management, Department of",Operations Research,Engineering,Engineering,True
"Information, Risk, and Operations Management, Department of",Management Information Systems,Business,Business,False
"Business - Camden, School of",Business Administration,Business,Business,False
"Biochemistry and Molecular Biology, Department of",Public Health,Health,Health,False
"Fine and Performing Arts, Department of",Art History and Criticism,"Language, Literature, Culture",Humanities,False
"Science, Technology, Engineering, and Mathematics Education, Department of",,Education,Education,False
"Administration, Rehabilitation and Postsecondary Education, Department of","Exercise Science, Kinesiology, Rehab, Health",Health,Health,False
"Administration, Rehabilitation and Postsecondary Education, Department of",,Education,Education,False
"Administration, Rehabilitation and Postsecondary Education, Department of",Education Administration,Education,Education,False
"Bicultural-Bilingual Studies, Department of",,Education,Education,False
"Technology, Department of",,Engineering,Engineering,True
"Second Language Acquisition and Teaching, GIDP",,Education,Education,False
"English, Department of",,"Language, Literature, Culture",Humanities,False
"Statistics and Probability, Department of",Statistics,Mathematical Sciences,Mathematics and Computing,True
"Chemistry and Chemical Biology , Department of",Chemistry,Chemical Sciences,Natural Sciences,True
"Chemistry and Chemical Biology , Department of",Pharmaceutical Sciences,Medical Sciences,Medicine,True
"Chemistry and Chemical Biology , Department of",Materials Engineering,Engineering,Engineering,True
"Chemistry and Chemical Biology , Department of",Biochemistry,Biological Sciences,Natural Sciences,True
International Affairs Program,International Affairs,Political Science,Social Sciences,False
"Health and Kinesiology, Department of","Exercise Science, Kinesiology, Rehab, Health",Health,Health,False
"Social and Behavioral Sciences, Department of",,,,
"Exercise and Health Sciences, Department of","Exercise Science, Kinesiology, Rehab, Health",Health,Health,False
"Public Policy and Urban Affairs, School of",Public Policy,Public Administration and Policy,Public Administration and Policy,False
"Public Policy and Urban Affairs, School of",Urban and Regional Planning,"Architecture, Design, Planning",Humanities,False
"Computer Science and Engineering, Department of",,Engineering,Engineering,True
"Electrical Engineering and Computer Science, School of",Computer Science,Computational Sciences,Mathematics and Computing,True
"Electrical Engineering and Computer Science, School of",Electrical Engineering,Engineering,Engineering,True
"Industrial and Physical Pharmacy, Department of",Pharmaceutical Sciences,Medical Sciences,Medicine,True
"Crop and Soil Science, Department of",Agronomy,Agriculture,Natural Sciences,True
"Soil and Crop Sciences, Department of",Agronomy,Agriculture,Natural Sciences,True
"Soil and Crop Sciences, Department of",Soil Science,Agriculture,Natural Sciences,True
"Languages and Cultures, School of",,"Language, Literature, Culture",Humanities,False
"Spanish and Portuguese Studies, The Division of",Spanish Language and Literature,"Language, Literature, Culture",Humanities,False
"Modern Foreign Languages and Literatures, Department of",,"Language, Literature, Culture",Humanities,False
"World Languages, Literatures, and Cultures, Department of",,"Language, Literature, Culture",Humanities,False
"Environment and Society, Department of",Natural Resources,Earth Sciences,Natural Sciences,True
"Environment and Society, Department of",Environmental Sciences,Earth Sciences,Natural Sciences,True
"Forestry and Natural Resources, Division of",Natural Resources,Earth Sciences,Natural Sciences,True
"Forestry and Natural Resources, Division of",Forestry and Forest Resources,Earth Sciences,Natural Sciences,True
"Construction Management Technology, School of",,"Architecture, Design, Planning",Humanities,False
"Construction, Myers-Lawson School of",Civil Engineering,Engineering,Engineering,True
"Civil and Construction Engineering, Department of",Civil Engineering,Engineering,Engineering,True
"Professional Studies, Goodwin College of",,Education,Education,False
"Hotel and Restaurant Administration, School of",,Business,Business,False
"Architecture and Design, College of",Architecture,"Architecture, Design, Planning",Humanities,False
"Speech, Language and Hearing Sciences, Department of",Speech and Hearing Sciences,Health,Health,False
"Communication Sciences & Disorders, Department of",Speech and Hearing Sciences,Health,Health,False
"Communication Sciences & Disorders, Department of",Communication Disorders and Sciences,Health,Health,False
"Hearing and Speech Sciences, Department of",Speech and Hearing Sciences,Health,Health,False
"Hearing and Speech Sciences, Department of",Communication Disorders and Sciences,Health,Health,False
"Biobehavioral Sciences, Department of",Speech and Hearing Sciences,Health,Health,False
"Biobehavioral Sciences, Department of","Exercise Science, Kinesiology, Rehab, Health",Health,Health,False
"Behavioral and Brain Sciences, School of",Communication Disorders and Sciences,Health,Health,False
"Behavioral and Brain Sciences, School of",,Biological Sciences,Natural Sciences,True
"Speech Language and Hearing, Department of",Speech and Hearing Sciences,Health,Health,False
"Health and Aging, Institute for",,Health,Health,False
"Engineering and Public Policy, Department of",,Engineering,Engineering,True
"Engineering and Public Policy, Department of",Public Policy,Public Administration and Policy,Public Administration and Policy,False
"Educational Administration and Human Resource Development, Department of",Education Administration,Education,Education,False
"Aviation Science, Department of",,Business,Business,False
"Public Administration, School of",Public Administration,Public Administration and Policy,Public Administration and Policy,False
"Agricultural Leadership, Education and Communication, Department of",,Education,Education,False
"Pharmacy Practice, Department of",Pharmacy,Medical Sciences,Medicine,True
"Computational Medicine and Bioinformatics, Department of",,Biological Sciences,Natural Sciences,True
"Mathematics, Department of",,Mathematical Sciences,Mathematics and Computing,True
"Ecology, School of",Ecology,Biological Sciences,Natural Sciences,True
"Ecology, School of",Natural Resources,Earth Sciences,Natural Sciences,True
"Bioinformatics, Institute of",,Biological Sciences,Natural Sciences,True
"Environmental Science and Policy, Department of",Environmental Sciences,Earth Sciences,Natural Sciences,True
"Modern and Classical Language and Literatures, Department of",Classics and Classical Languages,"Language, Literature, Culture",Humanities,False
Africana Studies and Research Center,,"Language, Literature, Culture",Humanities,False
Creative Writing Program,,"Language, Literature, Culture",Humanities,False
"Architecture and Urban Planning, College of",Architecture,"Architecture, Design, Planning",Humanities,False
"Architecture and Urban Planning, College of",Urban and Regional Planning,"Architecture, Design, Planning",Humanities,False
"Global Gender Studies, Department of",Gender Studies,Gender Studies,Social Sciences,False
Religion Department,Religious Studies,Theology and Religion,Humanities,False
"Screen Arts and Cultures, Department of",,,,
"Public Communication, Division of",Communication,"Journalism, Media, Communication","Journalism, Media, Communication",False
"Health Behavior and Health Education, Department of","Exercise Science, Kinesiology, Rehab, Health",Health,Health,False
"Health Behavior and Health Education, Department of","Health, Physical Education, Recreation",Health,Health,False
"Media and Information, Department of",Mass Communications and Media Studies,"Journalism, Media, Communication","Journalism, Media, Communication",False
"Media and Information, Department of",Information Science,Computational Sciences,Mathematics and Computing,True
"Computer Science, Department of",Information Science,Computational Sciences,Mathematics and Computing,True
"Electrical and Computer Engineering, Division of",Computer Engineering,Computational Sciences,Mathematics and Computing,True
"Electrical and Computer Engineering, Division of",Electrical Engineering,Engineering,Engineering,True
Heinz College,Management Information Systems,Business,Business,False
Heinz College,Public Policy,Public Administration and Policy,Public Administration and Policy,False
"Physical Medicine and Rehabilitation, Department of","Exercise Science, Kinesiology, Rehab, Health",Health,Health,False
"Technology, College of",,Engineering,Engineering,True
"Systems and Industrial Engineering, Department of",Industrial Engineering,Engineering,Engineering,True
"Systems and Industrial Engineering, Department of",Systems Engineering,Engineering,Engineering,True
Institute for Medical Engineering and Science (IMES),Agricultural Engineering,Engineering,Engineering,True
"Engineering and Management, Graduate School of",,Engineering,Engineering,True
"Engineering and Management, Graduate School of",Management,Business,Business,False
"Health Promotion and Policy, Department of",Public Health,Health,Health,False
"Health Promotion and Policy, Department of","Exercise Science, Kinesiology, Rehab, Health",Health,Health,False
"Biological Science, Department of",Biological Sciences,Biological Sciences,Natural Sciences,True
"Pharmacology and Pharmaceutical Sciences, Department of",Pharmacy,Medical Sciences,Medicine,True
"Pharmacology and Pharmaceutical Sciences, Department of",Pharmacology,Medical Sciences,Medicine,True
"Pharmacology and Pharmaceutical Sciences, Department of",Pharmaceutical Sciences,Medical Sciences,Medicine,True
"Archaeology and the Ancient World, Artemis A.W. and Martha Sharp Joukowsky Institute for",,"Language, Literature, Culture",Humanities,False
"Teaching and Learning, Policy and Leadership, Department of",Curriculum and Instruction,Education,Education,False
"Educational Psychology, Department of",Education,Education,Education,False
"Educational Research Methodology, Department of",,Education,Education,False
"Teacher Education and Learning Sciences, Department of",Educational Psychology,Psychological Sciences,Social Sciences,False
"Teacher Education and Learning Sciences, Department of",Curriculum and Instruction,Education,Education,False
"Teacher Education and Learning Sciences, Department of",,Education,Education,False
"Teacher Education and Learning Sciences, Department of",Counselor Education,Education,Education,False
"Teacher Education, Department of",Curriculum and Instruction,Education,Education,False
"Administrative and Organizational Studies, Division of",Education Administration,Education,Education,False
"Educational Leadership and Cultural Foundations, Department of",Education Administration,Education,Education,False
"Educational Leadership and Cultural Foundations, Department of",,Education,Education,False
Teacher Education (Division/Area),,Education,Education,False
"Kinesiology, Health and Sport Studies, Division of","Exercise Science, Kinesiology, Rehab, Health",Health,Health,False
"Behavioral and Social Sciences, Department of",Public Health,Health,Health,False
"Anthropology and Middle Eastern Cultures, Department of",Near and Middle Eastern Languages and Cultures,"Language, Literature, Culture",Humanities,False
"Anthropology and Middle Eastern Cultures, Department of",Anthropology,Anthropology,Social Sciences,False
"Electrical, Computer and Energy Engineering, School of",Electrical Engineering,Engineering,Engineering,True
"Electrical, Computer and Energy Engineering, School of",Computer Engineering,Computational Sciences,Mathematics and Computing,True
"Health Policy and Management, Division of",Public Health,Health,Health,False
"Health Policy and Management, Department Of",Public Policy,Public Administration and Policy,Public Administration and Policy,False
"Community Health Sciences, Division of",Public Health,Health,Health,False
Health Policy and Systems Management Unit,,Health,Health,False
"Health Law, Policy and Management, Department of",Public Health,Health,Health,False
"Management, Information Systems and Quantitative Methods, Department of",Management,Business,Business,False
"Management, Information Systems and Quantitative Methods, Department of",Management Information Systems,Business,Business,False
"Clinical, Social and Administrative Sciences, Department of",Pharmacy,Medical Sciences,Medicine,True
"Environment and Sustainability, Institute of the",Environmental Sciences,Earth Sciences,Natural Sciences,True
"Leadership and Public Policy, Frank Batten School of",Education Administration,Education,Education,False
"Leadership and Public Policy, Frank Batten School of",Public Policy,Public Administration and Policy,Public Administration and Policy,False
"Politics, Department of",International Affairs,Political Science,Social Sciences,False
"Atmospheric Sciences, Department of",Natural Resources,Earth Sciences,Natural Sciences,True
"Atmospheric Sciences, Department of",Geology,Earth Sciences,Natural Sciences,True
"Atmospheric, Oceanic and Space Sciences, Department of",Atmospheric Sciences and Meteorology,Physical Sciences,Natural Sciences,True
"Atmospheric, Oceanic and Space Sciences, Department of",Marine Sciences,Earth Sciences,Natural Sciences,True
"Atmospheric, Oceanic and Space Sciences, Department of",,Earth Sciences,Natural Sciences,True
"Environmental and Forest Sciences, School of",Forestry and Forest Resources,Earth Sciences,Natural Sciences,True
"Forestry and Environmental Studies, School of",Forestry and Forest Resources,Earth Sciences,Natural Sciences,True
"Forestry and Environmental Studies, School of",Environmental Sciences,Earth Sciences,Natural Sciences,True
"Criminology, Department of",Criminal Justice and Criminology,Sociology,Social Sciences,False
"Experimental and Clinical Pharmacology, Department of",Pharmacology,Medical Sciences,Medicine,True
"Biological Chemistry, Department of",Biochemistry,Biological Sciences,Natural Sciences,True
"Civil, Environmental, and Geo- Engineering, Department of",,Engineering,Engineering,True
"Civil, Environmental, and Geo- Engineering, Department of",Civil Engineering,Engineering,Engineering,True
"Civil, Environmental, and Geo- Engineering, Department of",Environmental Engineering,Engineering,Engineering,True
"Civil and Coastal Engineering, Department of",Civil Engineering,Engineering,Engineering,True
"Sustainable Infrastructure and Environment, Engineering School of",Civil Engineering,Engineering,Engineering,True
"Genetics, Cell Biology, and Development, Department of",Cell Biology,Biological Sciences,Natural Sciences,True
"Genetics, Cell Biology, and Development, Department of",Genetics,Medical Sciences,Medicine,True
"Statistics, School of",Statistics,Mathematical Sciences,Mathematics and Computing,True
"American Indian Studies, Department of",,"Language, Literature, Culture",Humanities,False
"Global Health and Social Medicine, Department of",Public Health,Health,Health,False
"Mexican American and Latina/o Studies, Department of",,"Language, Literature, Culture",Humanities,False
"Music, Setnor School of",Music,Arts,Humanities,False
"Music, College of",Music,Arts,Humanities,False
Mead Witter School of Music,Music,Arts,Humanities,False
"Community-Public Health, Department of",Public Health,Health,Health,False
"Community-Public Health, Department of",Nursing,Health,Health,False
"Business, Carey School of",Business Administration,Business,Business,False
Business School - Economics,Economics,Economics,Social Sciences,False
"Management and Human Resources, Department of",Management,Business,Business,False
"Strategy, Economics, Ethics, and Public Policy, Division of",Business Administration,Business,Business,False
Accounting and Management Unit,Management,Business,Business,False
Accounting and Management Unit,Accounting,Business,Business,False
"Epidemiology and Community Health, Department of",Epidemiology,Medical Sciences,Medicine,True
"Epidemiology and Community Health, Department of",Public Health,Health,Health,False
"Health Promotion, Education and Behavior, Department of","Exercise Science, Kinesiology, Rehab, Health",Health,Health,False
"Applied Physiology and Kinesiology, Department of","Exercise Science, Kinesiology, Rehab, Health",Health,Health,False
"Applied Physiology and Kinesiology, Department of",Physiology,Medical Sciences,Medicine,True
"Health Systems and Outcomes, Department of",,Health,Health,False
"Nursing, Graduate School of",Nursing,Health,Health,False
"Counseling and Family Sciences, Department of",Counselor Education,Education,Education,False
"Health Promotion and Disease Prevention, Department of",Public Health,Health,Health,False
"Earth and Planetary Sciences, Department of",Geology,Earth Sciences,Natural Sciences,True
"Earth and Planetary Sciences, Department of",Astronomy,Physical Sciences,Natural Sciences,True
"Geological Sciences, Department of",Environmental Sciences,Earth Sciences,Natural Sciences,True
"Geoscience, Department of",,Earth Sciences,Natural Sciences,True
"Geoscience, Department of",Atmospheric Sciences and Meteorology,Physical Sciences,Natural Sciences,True
"Kinesiology and Nutrition, Department of","Exercise Science, Kinesiology, Rehab, Health",Health,Health,False
"Microbiology, Department of",Immunology,Medical Sciences,Medicine,True
"Design, School of",,"Architecture, Design, Planning",Humanities,False
"Theatre and Drama, Department of","Theatre Literature, History and Criticism","Language, Literature, Culture",Humanities,False
"Dramatic Art, Department of",,,,
"Anatomy, Department of",Anatomy,Biological Sciences,Natural Sciences,True
